{
  "$schema": "https://json-schema.org/draft/2020-12/schema",
  "$id": "https://sma/schemas/merge-proposal.schema.json",
  "title": "SMA Merge Proposal",
  "description": "This schema defines the review record created when two agent edit chains diverge on the same brick. Controllers, reviewers, and merge tooling need it when they compare intents, files, leases, and resolution choices. Read it before selecting a preferred chain or recording a manual merge. Remember that the proposal records each chain's intent and byte-level conflicts.",
  "x-sma-contract": {
    "version": "1.0.0",
    "change_policy": "Optional additive fields preserve v1 compatibility; required, renamed, or narrowed fields require a new versioned $id and schema_version.",
    "rollback": "Consumers retain the v1 decoder during the compatibility window; rollback drops only additive optional fields and never rewrites immutable or historical evidence.",
    "readers": [
      "tools/sma-validate-gen3.ts",
      "Gen3 controllers"
    ],
    "writers": [
      "tools/sma-merge.ts"
    ],
    "lifecycle": "Created or regenerated by the listed writer, validated at its consumer boundary, and retained according to docs/SCHEMA_CONTRACTS.md.",
    "retention": "See docs/SCHEMA_CONTRACTS.md for the artifact-specific retention rule.",
    "performance": "Static file contract; database query plans, indexes, and full-scan budgets are not applicable. Validation performance is covered by schema-case selftests."
  },
  "type": "object",
  "required": [
    "schema_version",
    "proposal_id",
    "brick_id",
    "generated_at",
    "chains",
    "files",
    "recommendation"
  ],
  "additionalProperties": false,
  "properties": {
    "schema_version": {
      "const": "1.0.0",
      "description": "Schema version that this document conforms to."
    },
    "proposal_id": {
      "type": "string",
      "description": "Stable identifier of this merge proposal."
    },
    "brick_id": {
      "type": "string",
      "description": "Stable identifier of the brick associated with this record."
    },
    "project": {
      "type": "string",
      "description": "Project identifier associated with the record."
    },
    "generated_at": {
      "type": "string",
      "description": "Time when this document was generated, in ISO 8601 date-time format.",
      "format": "date-time"
    },
    "chains": {
      "type": "array",
      "description": "Ordered chains values for the record.",
      "minItems": 2,
      "items": {
        "type": "object",
        "required": [
          "chain_id",
          "agent_id",
          "intents",
          "events"
        ],
        "additionalProperties": false,
        "properties": {
          "chain_id": {
            "type": "string",
            "description": "Recorded chain identifier for the items."
          },
          "agent_id": {
            "type": "string",
            "description": "Recorded agent identifier for the items."
          },
          "session_id": {
            "type": "string",
            "description": "Identifier of the agent session that produced this value."
          },
          "actor_kind": {
            "type": "string",
            "description": "Category of actor that performed the action."
          },
          "model": {
            "type": "string",
            "description": "Model identifier recorded for an AI-driven actor."
          },
          "started_at": {
            "type": "string",
            "description": "Time when the edit chain started, in ISO 8601 date-time format.",
            "format": "date-time"
          },
          "ended_at": {
            "type": "string",
            "description": "Time when the edit chain ended, in ISO 8601 date-time format.",
            "format": "date-time"
          },
          "intents": {
            "type": "array",
            "items": {
              "type": "string"
            },
            "description": "Distinct intent statements pulled from the chain's agent-context events."
          },
          "events": {
            "type": "array",
            "description": "Ordered events values for the chain.",
            "items": {
              "type": "string",
              "description": "event_id refs into the agent-context log"
            }
          },
          "files_touched": {
            "type": "array",
            "description": "Repository-relative files changed by the recorded work.",
            "items": {
              "type": "string"
            },
            "uniqueItems": true
          },
          "lease_ids": {
            "type": "array",
            "description": "Ordered lease ids values for the chain.",
            "items": {
              "type": "string"
            }
          }
        }
      }
    },
    "files": {
      "type": "array",
      "description": "Ordered files values for the record.",
      "items": {
        "type": "object",
        "required": [
          "path",
          "status"
        ],
        "additionalProperties": false,
        "properties": {
          "path": {
            "type": "string",
            "description": "Repository-relative path to the file."
          },
          "status": {
            "enum": [
              "only_in_chain_a",
              "only_in_chain_b",
              "diverged",
              "agreed",
              "manifest_field_diverged"
            ],
            "description": "Current status of the file."
          },
          "diverged_field": {
            "type": "string",
            "description": "If status is manifest_field_diverged, the JSON pointer of the field."
          }
        }
      }
    },
    "recommendation": {
      "type": "object",
      "description": "Fields that describe the recommendation.",
      "required": [
        "preferred_chain",
        "reason"
      ],
      "additionalProperties": false,
      "properties": {
        "preferred_chain": {
          "type": "string",
          "description": "chain_id, or 'manual' if no clear winner"
        },
        "reason": {
          "type": "string",
          "description": "Plain-language reason for this decision."
        }
      }
    },
    "resolved_at": {
      "type": "string",
      "description": "Time when the proposal was resolved, in ISO 8601 date-time format.",
      "format": "date-time"
    },
    "resolved_by": {
      "type": "string",
      "description": "Identifier of the actor that resolved the proposal."
    },
    "resolution_kind": {
      "type": "string",
      "description": "Selected resolution kind; allowed values are `accepted_a`, `accepted_b`, `manual_merge`, `discarded_a`, `discarded_b`, `fork`.",
      "enum": [
        "accepted_a",
        "accepted_b",
        "manual_merge",
        "discarded_a",
        "discarded_b",
        "fork"
      ]
    },
    "resolution_notes": {
      "type": "string",
      "description": "Notes explaining how the proposal was resolved."
    }
  }
}
